{
  "$schema": "https://json-schema.org/draft/2020-12/schema",
  "type": "object",
  "additionalProperties": true,
  "required": ["status"],
  "properties": {
    "status": {
      "type": "string",
      "enum": ["completed", "failed", "partial"]
    },
    "summary": {
      "type": "string"
    },
    "artifacts": {
      "type": "array",
      "items": {
        "type": "object",
        "required": ["path", "type", "title"],
        "properties": {
          "path": { "type": "string" },
          "type": { "type": "string" },
          "title": { "type": "string" }
        }
      }
    },
    "capability_calls": {
      "type": "array",
      "items": { "type": "object", "additionalProperties": true }
    },
    "next_actions": {
      "type": "array",
      "items": { "type": "string" }
    },
    "error": {
      "oneOf": [
        { "type": "null" },
        {
          "type": "object",
          "required": ["code", "message"],
          "properties": {
            "code": { "type": "string" },
            "message": { "type": "string" },
            "recoverable": { "type": "boolean" },
            "suggested_action": { "type": "string" }
          }
        }
      ]
    }
  }
}
