{
  "status": "completed",
  "summary": "执行 Set 1-9 完成：项目初始化、数据层、工具层、IS/WIS、DM、DR/SNDR、FQE、评估框架、Callback。预生成 CartPole+DQN 和 Pendulum+SAC 的策略+轨迹 fixtures。",
  "artifacts": [
    {
      "path": "openair/ope-benchmark/new_execute/task_set_1.md",
      "type": "stage_summary",
      "title": "Set 1 执行总结"
    },
    {
      "path": "openair/ope-benchmark/new_execute/task_set_9.md",
      "type": "stage_summary",
      "title": "Set 9 执行总结"
    }
  ],
  "capability_calls": [
    {
      "skill_id": "code_implementation",
      "count": 9
    }
  ],
  "next_actions": [
    "执行 Set 10-13 主实验"
  ],
  "error": null
}
