{
  "status": "completed",
  "summary": "实现 sb3_ope 主库全部模块，43 个测试全部通过。预生成 fixtures 支持无训练测试。",
  "artifacts": [
    {
      "path": "sb3_ope/sb3_ope/data/",
      "type": "code_result",
      "title": "数据层 (TrajectoryDataset + DataCollector)"
    },
    {
      "path": "sb3_ope/sb3_ope/estimators/",
      "type": "code_result",
      "title": "8 种 OPE 估计器"
    },
    {
      "path": "sb3_ope/sb3_ope/evaluation/",
      "type": "code_result",
      "title": "评估框架 (MSE/Bias/Variance/RankCorrelation)"
    },
    {
      "path": "sb3_ope/sb3_ope/callbacks/",
      "type": "code_result",
      "title": "SB3 OPECallback"
    }
  ],
  "capability_calls": [],
  "next_actions": [
    "执行 Set 1-9 验证全部模块"
  ],
  "error": null
}
