{
  "status": "completed",
  "summary": "构建 3 个递进式假说链：H1''(排序变化) → H2''(可预测性) → H3''(数据效率)，经 v1→v2→v3 三轮迭代。",
  "artifacts": [
    {
      "path": "openair/ope-benchmark/proposal/proposal-v3.md",
      "type": "research_note",
      "title": "研究提案 v3"
    }
  ],
  "capability_calls": [],
  "next_actions": [
    "基于假说设计实验方案"
  ],
  "error": null
}
