{
  "status": "completed",
  "summary": "初始化执行阶段，扫描 task_plan.md 生成 14 个 Task Set 的执行状态文件，支持断点续跑。",
  "artifacts": [
    {
      "path": "openair/ope-benchmark/new_execute/task_sets.md",
      "type": "stage_summary",
      "title": "Task Set 划分结果"
    },
    {
      "path": "openair/ope-benchmark/new_execute/.task_sets_state.json",
      "type": "code_result",
      "title": "Task Set 状态管理文件"
    },
    {
      "path": "openair/ope-benchmark/new_execute/.meta_config.json",
      "type": "code_result",
      "title": "元数据配置"
    }
  ],
  "capability_calls": [],
  "next_actions": [
    "按 Task Set 顺序逐个执行"
  ],
  "error": null
}
